{
  "bundle_id": "lamina_seg:lamina_seg",
  "bundle_version": "v1",
  "package_name": "lamina_seg",
  "runtime_profile": "clinical_mainline",
  "training_run_id": "lamina_seg:03267a14afc86481",
  "dataset_source": "fixture",
  "dataset_hash": "37d7785248279a475fcd43178c5df9ca03d225ad8e1bbc35ee80e393b1e3dce0",
  "trainer_backend": "numpy_baseline",
  "release_state": "research_fixture",
  "clinical_claim": "non_clinical_research_only",
  "benchmark_manifest_path": "",
  "strict_runtime_required": true,
  "artifacts": {
    "weights_path": "parameters.json",
    "entrypoint": "spine_ultrasound_ui.training.runtime_adapters.lamina_seg",
    "parameter_path": "parameters.json",
    "meta_path": "model_meta.json"
  },
  "compatibility": {
    "robot_models": [
      "xmate3",
      "xmate7",
      "xmateer3pro",
      "xmateer7pro"
    ],
    "runtime_modes": [
      "core",
      "headless_review"
    ]
  },
  "preprocess": {},
  "postprocess": {},
  "metrics": {
    "sample_count": 1,
    "positive_score_mean": 0.18254,
    "negative_score_mean": 0.5,
    "median_shape": [
      8,
      8
    ]
  }
}